{
  "feature": "monorepo-and-local-environment",
  "version": "v1",
  "status": "PASS",
  "commit": "1891ff9c675b2fb6b89d0612fd2f34841a348a7e",
  "base": "main",
  "branch": "feature/BP-001",
  "reviewedBy": "specdrive-review-agent",
  "reviewedAt": "2026-10-31T14:15:00.000Z",
  "coverage": 100,
  "criteria": [
    {
      "id": "C01-spec-convergence",
      "status": "pass",
      "detail": "sdrive verify returns warn: matched 11, missing 0, renamed 0, extra 36. The 36 extras are files present but unplanned; CON-602 accepts warn."
    },
    {
      "id": "C02-task-completion",
      "status": "pass",
      "detail": "tasks.json: 7 tasks - 6 completed true, 1 resolved (T3.2, deferred with a reason), 0 outstanding. tasks.md shows the same, with T3.2 marked deferred."
    },
    {
      "id": "C03-traceability",
      "status": "pass",
      "detail": "traceability.json has 10 rows covering all 7 acceptance criteria, each linked to a plan section, task IDs and test IDs. NFR-001 remains in_progress because the five-minute target is unmeasured - disclosed at the gate."
    },
    {
      "id": "C04-coverage",
      "status": "pass",
      "detail": "7 of 7 acceptance criteria in scope, 0 withdrawn, 7 linked to passing tests = 100%."
    },
    {
      "id": "C05-test-report",
      "status": "pass",
      "detail": ".sdrive/reports/tests/test-report-monorepo-and-local-environment-v1-2026-10-31.md exists, records 7/7 passed and 100% coverage, and is newer than spec.md and plan.md."
    },
    {
      "id": "C06-test-evidence",
      "status": "pass",
      "detail": "test-evidence.json: exitCode 0, summary.failed 0, commit 1891ff9 equals HEAD, branch feature/BP-001, recorded 2026-10-31T14:25:04Z. summary counts are 0 because the recorder cannot parse node:test TAP, so results are carried by testIds TEST-001 through TEST-007, which is the route the gate itself names."
    },
    {
      "id": "C07-change-scope",
      "status": "pass",
      "detail": "The 33-file diff against main is planned: docker-compose.yml, scripts/setup-env.mjs, package.json, server/.env.example, README.md, the four test files, the feature's spec/plan/tasks and governance artifacts, plus the disclosed verify.js and plan reclassification. Branch matches feature.branch and is based on main. One path is uncommitted: .sdrive/audit-log.json, an append-only ledger written by every sdrive command - see finding F2."
    },
    {
      "id": "C08-test-quality",
      "status": "pass",
      "detail": "Every test name carries both its TEST-### ID and its AC ID. No .only, xit or xdescribe. Two conditional guards are justified and documented: the Docker daemon check in TEST-007 and the plan-presence check in the verifier regression test."
    },
    {
      "id": "C09-code-quality",
      "status": "pass",
      "detail": "pnpm lint exit 0 (web carries two pre-existing Next warnings), pnpm typecheck exit 0 with Done for all three packages, and prettier --check passes on every file this feature touched."
    },
    {
      "id": "C10-security",
      "status": "pass",
      "detail": "This feature adds no authentication, request input or HTTP surface, so CON-511 to CON-518 and CON-520 are NOT APPLICABLE with their rationale recorded in spec.md section 6. The single applicable control, CON-519 Environment Security, is expanded into NFR-002 and verified by TEST-006: only .env.example files are committed, no credential shapes appear, and the JWT value is a placeholder."
    },
    {
      "id": "C11-testing",
      "status": "pass",
      "detail": "node --test across four files: 7 passed, 0 failed, 0 skipped. The stack test ran against the live compose stack (three services healthy); it skips itself when no Docker daemon is present."
    },
    {
      "id": "C12-documentation",
      "status": "pass",
      "detail": "README.md rewrote the quick start around pnpm setup, added a backing-services table with ports and volumes, and added a troubleshooting table. CONTRIBUTING.md documents all three patched framework files. The repository has no CHANGELOG."
    },
    {
      "id": "C13-nfr-evidence",
      "status": "not_verified",
      "detail": "NFR-002, NFR-003 and NFR-004 are covered by tests. NFR-001, the five-minute fresh-clone target, is unmeasured: the 71.1 s recorded is docker compose up -d on a warm image cache, not a clone through pnpm install. It is recorded as in_progress rather than claimed, and disclosed at the decision gate."
    },
    {
      "id": "C14-definition-of-done",
      "status": "pass",
      "detail": "Tasks complete or explicitly resolved, coverage 100%, traceability complete, evidence bound to HEAD, lint and typecheck clean, security baseline addressed, documentation updated - with C13 and C16 disclosed to the human, who confirmed the PASS."
    },
    {
      "id": "C15-spec-to-code-verification",
      "status": "pass",
      "detail": "sdrive verify returns warn (matched 11, missing 0, renamed 0, extra 36). CON-602 accepts warn."
    },
    {
      "id": "C16-ci",
      "status": "not_verified",
      "detail": ".github/workflows/ci.yml triggers on pushes to main/master and on pull requests only, so no run exists for feature/BP-001, and the review agent may not open a PR. Recorded, not passed."
    },
    {
      "id": "C17-permission",
      "status": "pass",
      "detail": "node .sdrive/scripts/check-permission.js slash /sdrive:review returned allowed for User kenule500 (admin) at the previous review. Not re-executed in this pass."
    },
    {
      "id": "C18-reviewer-independence",
      "status": "warn",
      "detail": "The workspace has a single member (kenule500, admin) who implemented the feature and requested this review. The conflict is recorded, and the PASS was confirmed explicitly by the human rather than self-approved."
    }
  ],
  "findings": [
    {
      "severity": "low",
      "issue": "NFR-001 (fresh clone to running stack within five minutes) is unmeasured. The 71.1 s figure recorded is docker compose up -d on a warm image cache, not a clone through pnpm install.",
      "location": ".sdrive/reports/tests/test-report-monorepo-and-local-environment-v1-2026-10-31.md",
      "fixRequired": false
    },
    {
      "severity": "low",
      "issue": ".sdrive/audit-log.json is the only uncommitted path. Every sdrive command appends a hash-chained entry, so the evidence run that C06 requires necessarily dirties the tree - the same tension that made test-evidence.json gitignored.",
      "location": ".sdrive/audit-log.json",
      "fixRequired": false
    },
    {
      "severity": "low",
      "issue": "No CI run exists for feature/BP-001. The workflow triggers on main/master pushes and pull requests only, and both historical main runs failed before the pnpm version conflict was fixed.",
      "location": ".github/workflows/ci.yml",
      "fixRequired": false
    },
    {
      "severity": "info",
      "issue": "The branch carries two infrastructure changes the feature's own verification depends on: the verify.js root-path fix (9d42d0c) and the node:fs dependency reclassification in plan.json and plan.md. Both are disclosed in their commit messages.",
      "location": ".sdrive/scripts/verify.js",
      "fixRequired": false
    },
    {
      "severity": "info",
      "issue": "Commits 310da1e and 9f0a8e6 are duplicates with identical messages and content, created when a wedged terminal replayed the command.",
      "location": ".git/logs/HEAD",
      "fixRequired": false
    },
    {
      "severity": "info",
      "issue": "Reviewer and implementer are the same workspace member, so the review is not independent. Recorded under C18 and human-confirmed.",
      "location": ".sdrive/workflow-state.json",
      "fixRequired": false
    }
  ],
  "evidence": {
    "testEvidence": ".sdrive/governance/monorepo-and-local-environment/v1/test-evidence.json - exit 0, 0 failed, commit 1891ff9 === HEAD, testIds TEST-001 through TEST-007, recorded 2026-10-31T14:25:04Z.",
    "testReport": ".sdrive/reports/tests/test-report-monorepo-and-local-environment-v1-2026-10-31.md - 7/7 passed, 100% coverage, newer than spec.md and plan.md.",
    "verification": "sdrive verify: warn - matched 11, missing 0, renamed 0, extra 36. sdrive check / validate / audit:verify: exit 0. pnpm lint exit 0, pnpm typecheck exit 0, prettier clean on the feature's files.",
    "audit": "Scope: 33 planned files against main. Stack: docker compose up -d in 71.1 s, postgres/redis/mongo all healthy. Dev ports: 3000, 4000 and [::1]:5173 verified manually. Coverage: 7/7 ACs, 0 withdrawn. CI: no run for the branch. Review bindings: HEAD 1891ff9, branch feature/BP-001, base main. The record was re-cut at 1891ff9 because the CLI requires the reviewed commit to equal HEAD; the tree differs from 9f0a8e6 only under .sdrive/."
  }
}
